{
  "contract_version": "footballai.analysis-run/v1",
  "logical_analysis_id": "44444444-4444-4444-8444-444444444444",
  "run_id": "dddddddd-dddd-4ddd-8ddd-ddddddddddd1",
  "attempt_number": 1,
  "previous_attempt_run_id": null,
  "status": "succeeded",
  "data_origin": "real",
  "input": {
    "uri": "fixture://safe-user-input/match-001.mp4",
    "sha256": "5555555555555555555555555555555555555555555555555555555555555555",
    "media_type": "video/mp4"
  },
  "code": {
    "repository": "https://github.com/example/FootballAi",
    "revision": "84b5457e0058b64fb2cbf31ea795c168debdcae5",
    "dirty": false
  },
  "pipeline_version": "2.0.0",
  "parameters": {"effective_fps": 5},
  "models": [{"name": "detector-adapter", "version": "benchmark-placeholder"}],
  "artifacts": [
    {
      "artifact_id": "team-summary",
      "name": "Team summary",
      "category": "summary",
      "relative_path": "artifacts/team_summary.json",
      "media_type": "application/json",
      "sha256": "6666666666666666666666666666666666666666666666666666666666666666",
      "size_bytes": 256,
      "schema_version": "footballai.team-summary/v1"
    },
    {
      "artifact_id": "workload-advisory",
      "name": "Workload and Fatigue Advisory",
      "category": "workload_advisory",
      "relative_path": "artifacts/workload_advisory.json",
      "media_type": "application/json",
      "sha256": "7777777777777777777777777777777777777777777777777777777777777777",
      "size_bytes": 512,
      "schema_version": "footballai.workload-advisory/v1"
    }
  ],
  "stages": [
    {
      "stage_id": "metrics-1",
      "stage_name": "metrics",
      "required": true,
      "status": "succeeded",
      "progress_percent": 100,
      "attempt_number": 1,
      "started_at": "2026-07-26T12:00:01Z",
      "finished_at": "2026-07-26T12:01:00Z",
      "produced_artifact_ids": ["team-summary"],
      "error": null,
      "performance_metrics": {"duration_seconds": 59, "frames_processed": 300, "processing_fps": 5.08},
      "message": "Team metrics completed."
    },
    {
      "stage_id": "workload-advisory-1",
      "stage_name": "workload_advisory",
      "required": true,
      "status": "succeeded",
      "progress_percent": 100,
      "attempt_number": 1,
      "started_at": "2026-07-26T12:01:00Z",
      "finished_at": "2026-07-26T12:01:10Z",
      "produced_artifact_ids": ["workload-advisory"],
      "error": null,
      "performance_metrics": {"duration_seconds": 10, "input_count": 12, "output_count": 12},
      "message": "Advisory indicators completed; they are not medical diagnosis."
    },
    {
      "stage_id": "artifact-publication-1",
      "stage_name": "artifact_publication",
      "required": true,
      "status": "succeeded",
      "progress_percent": 100,
      "attempt_number": 1,
      "started_at": "2026-07-26T12:01:10Z",
      "finished_at": "2026-07-26T12:01:11Z",
      "produced_artifact_ids": [],
      "error": null,
      "performance_metrics": {"duration_seconds": 1, "output_count": 2},
      "message": "Registered artifacts were verified."
    }
  ],
  "created_at": "2026-07-26T12:00:00Z",
  "started_at": "2026-07-26T12:00:01Z",
  "completed_at": "2026-07-26T12:01:11Z"
}
